[
  {
    "id": "fbc-haemoglobin-low",
    "panel": "full_blood_count",
    "analyte": "haemoglobin",
    "aliases": [
      "Hb",
      "haemoglobin",
      "hemoglobin"
    ],
    "band": "low",
    "title": "Haemoglobin below the range on your report",
    "text": "Haemoglobin is the protein in red blood cells that carries oxygen. Your result is below the range printed on your report. A result below the usual range for that laboratory means this sample had less haemoglobin than that range. People sometimes use the word anaemia for a low result, but this number does not say what the cause is. This passage is general information for a prototype. It is not a diagnosis and it does not say what should happen next. Your GP can read this result with the rest of your report.",
    "simulatedUrl": "https://example.nhs.uk/explain/haemoglobin"
  },
  {
    "id": "fbc-haemoglobin-normal",
    "panel": "full_blood_count",
    "analyte": "haemoglobin",
    "aliases": [
      "Hb",
      "haemoglobin",
      "hemoglobin"
    ],
    "band": "normal",
    "title": "Haemoglobin inside the range on your report",
    "text": "Haemoglobin is the protein in red blood cells that carries oxygen. Your result is inside the range printed on your report. A result inside the printed range sits where that laboratory usually expects haemoglobin to be. One result inside the range does not describe the rest of your health. This passage is general information for a prototype. It is not a diagnosis and it does not say what should happen next. Your GP can read this result with the rest of your report.",
    "simulatedUrl": "https://example.nhs.uk/explain/haemoglobin"
  },
  {
    "id": "fbc-haemoglobin-high",
    "panel": "full_blood_count",
    "analyte": "haemoglobin",
    "aliases": [
      "Hb",
      "haemoglobin",
      "hemoglobin"
    ],
    "band": "high",
    "title": "Haemoglobin above the range on your report",
    "text": "Haemoglobin is the protein in red blood cells that carries oxygen. Your result is above the range printed on your report. A result above the usual range for that laboratory means this sample had more haemoglobin than that range. The number does not say why it is higher. This passage is general information for a prototype. It is not a diagnosis and it does not say what should happen next. Your GP can read this result with the rest of your report.",
    "simulatedUrl": "https://example.nhs.uk/explain/haemoglobin"
  },
  {
    "id": "fbc-white-cell-count-low",
    "panel": "full_blood_count",
    "analyte": "white_cell_count",
    "aliases": [
      "WBC",
      "white cell count",
      "white blood cell count",
      "leukocytes",
      "leucocytes"
    ],
    "band": "low",
    "title": "White cell count below the range on your report",
    "text": "White cells are blood cells that take part in how the body responds to infection and inflammation. Your result is below the range printed on your report. A count below the printed range means fewer white cells than that laboratory's usual range. Infections, some medicines, and other illnesses can sit behind a low count, and this passage cannot tell which applies. This passage is general information for a prototype. It is not a diagnosis and it does not say what should happen next. Your GP can read this result with the rest of your report.",
    "simulatedUrl": "https://example.nhs.uk/explain/white-cell-count"
  },
  {
    "id": "fbc-white-cell-count-normal",
    "panel": "full_blood_count",
    "analyte": "white_cell_count",
    "aliases": [
      "WBC",
      "white cell count",
      "white blood cell count",
      "leukocytes",
      "leucocytes"
    ],
    "band": "normal",
    "title": "White cell count inside the range on your report",
    "text": "White cells are blood cells that take part in how the body responds to infection and inflammation. Your result is inside the range printed on your report. A count inside the printed range sits where that laboratory usually expects the white cell count to be. This passage is general information for a prototype. It is not a diagnosis and it does not say what should happen next. Your GP can read this result with the rest of your report.",
    "simulatedUrl": "https://example.nhs.uk/explain/white-cell-count"
  },
  {
    "id": "fbc-white-cell-count-high",
    "panel": "full_blood_count",
    "analyte": "white_cell_count",
    "aliases": [
      "WBC",
      "white cell count",
      "white blood cell count",
      "leukocytes",
      "leucocytes"
    ],
    "band": "high",
    "title": "White cell count above the range on your report",
    "text": "White cells are blood cells that take part in how the body responds to infection and inflammation. Your result is above the range printed on your report. A count above the printed range means more white cells than that laboratory's usual range. Infection and inflammation can raise the count, and they are not the only reasons. This passage is general information for a prototype. It is not a diagnosis and it does not say what should happen next. Your GP can read this result with the rest of your report.",
    "simulatedUrl": "https://example.nhs.uk/explain/white-cell-count"
  },
  {
    "id": "fbc-platelets-low",
    "panel": "full_blood_count",
    "analyte": "platelets",
    "aliases": [
      "platelets",
      "platelet count",
      "PLT"
    ],
    "band": "low",
    "title": "Platelet count below the range on your report",
    "text": "Platelets are small cell fragments that help blood clot. Your result is below the range printed on your report. A count below the printed range means fewer platelets than that laboratory's usual range. Whether someone bruises or bleeds more easily is a judgement for a clinician, not a conclusion from this number alone. This passage is general information for a prototype. It is not a diagnosis and it does not say what should happen next. Your GP can read this result with the rest of your report.",
    "simulatedUrl": "https://example.nhs.uk/explain/platelets"
  },
  {
    "id": "fbc-platelets-normal",
    "panel": "full_blood_count",
    "analyte": "platelets",
    "aliases": [
      "platelets",
      "platelet count",
      "PLT"
    ],
    "band": "normal",
    "title": "Platelet count inside the range on your report",
    "text": "Platelets are small cell fragments that help blood clot. Your result is inside the range printed on your report. A count inside the printed range sits where that laboratory usually expects platelets to be. This passage is general information for a prototype. It is not a diagnosis and it does not say what should happen next. Your GP can read this result with the rest of your report.",
    "simulatedUrl": "https://example.nhs.uk/explain/platelets"
  },
  {
    "id": "fbc-platelets-high",
    "panel": "full_blood_count",
    "analyte": "platelets",
    "aliases": [
      "platelets",
      "platelet count",
      "PLT"
    ],
    "band": "high",
    "title": "Platelet count above the range on your report",
    "text": "Platelets are small cell fragments that help blood clot. Your result is above the range printed on your report. A count above the printed range means more platelets than that laboratory's usual range. Inflammation and low iron are among the reasons a count can be higher, and this passage does not pick a cause. This passage is general information for a prototype. It is not a diagnosis and it does not say what should happen next. Your GP can read this result with the rest of your report.",
    "simulatedUrl": "https://example.nhs.uk/explain/platelets"
  },
  {
    "id": "fbc-red-cell-count-low",
    "panel": "full_blood_count",
    "analyte": "red_cell_count",
    "aliases": [
      "RBC",
      "red cell count",
      "red blood cell count",
      "erythrocytes"
    ],
    "band": "low",
    "title": "Red cell count below the range on your report",
    "text": "The red cell count is the number of red blood cells in the sample. Your result is below the range printed on your report. A count below the printed range means fewer red cells than that laboratory's usual range. It is often read next to haemoglobin rather than on its own. This passage is general information for a prototype. It is not a diagnosis and it does not say what should happen next. Your GP can read this result with the rest of your report.",
    "simulatedUrl": "https://example.nhs.uk/explain/red-cell-count"
  },
  {
    "id": "fbc-red-cell-count-normal",
    "panel": "full_blood_count",
    "analyte": "red_cell_count",
    "aliases": [
      "RBC",
      "red cell count",
      "red blood cell count",
      "erythrocytes"
    ],
    "band": "normal",
    "title": "Red cell count inside the range on your report",
    "text": "The red cell count is the number of red blood cells in the sample. Your result is inside the range printed on your report. A count inside the printed range sits where that laboratory usually expects the red cell count to be. This passage is general information for a prototype. It is not a diagnosis and it does not say what should happen next. Your GP can read this result with the rest of your report.",
    "simulatedUrl": "https://example.nhs.uk/explain/red-cell-count"
  },
  {
    "id": "fbc-red-cell-count-high",
    "panel": "full_blood_count",
    "analyte": "red_cell_count",
    "aliases": [
      "RBC",
      "red cell count",
      "red blood cell count",
      "erythrocytes"
    ],
    "band": "high",
    "title": "Red cell count above the range on your report",